{
  "scope_slug": "ref-sweep-missing-year-20260714_1502_ET",
  "workflow": "refsweep",
  "tier": null,
  "countries": ["*"],
  "started": "2026-07-14",
  "built": "2026-07-14",
  "applied": null,
  "status": "built",
  "run_record": "batches/run_records/2026-07-14_missing-year-refsweep-recheck.md",
  "notes": "Re-check pass of the missing-year ref-sweep: global, fresh extract found only 6 remaining missing-year points (down from 148), confirming the 2026-07-01 pass's years were applied. Of the 6: 1 unresolved-structural (Porto Empedocle, no datable event), 5 are legacy crude-oil deepwater ports (fuel_type=Oil, not LNG) that were correctly left unapplied. Deliverable batches/deliverables/missing_year_refsweep_20260714_1505_ET.xlsx. This is the most current ref-sweep pass."
}
